{
  "package_id": "edu-qa-01-clear-affirmative",
  "title": "Clear affirmative grants for mortality, medical, and surgical",
  "scenario": "1. Clear affirmative coverage",
  "corpus_version": "quality-corpus-v1",
  "notes": "Educational classroom policy. Grants are explicit. No denial language.",
  "evaluation_scope": "analysis",
  "documents": [
    {
      "document_id": "edu-01-doc",
      "filename": "edu-01-package.pdf",
      "pages": [
        {
          "page": 1,
          "text": "Declarations\nIssued by: Educational Equine Specialty Insurance Company\nAgency: Classroom Agency\nAgent: Lesson Agent\nPolicy Number: EQ-EDU-0001\nNamed Insured: Jordan Rivers\nPolicy Effective Date: January 1, 2026\nPolicy Expiration Date: January 1, 2027\nPolicy Type: Equine Mortality\nInsured Horse Name: Lesson Horse\nBreed: Quarter Horse\nAge: 8\nSex: Gelding\nStated Use: Pleasure\nInsured Value / Full Mortality: $40,000\nCurrency: USD\nForms:\nEQ-A-1 Ed. 01/2024\nEQ-B-1 Ed. 01/2024"
        },
        {
          "page": 2,
          "text": "Base Policy Form EQ-A-1 Ed. 01/2024\nThis policy provides Full Mortality coverage for the insured horse.\nThis policy provides Major Medical coverage with a limit of $12,000 per policy period."
        },
        {
          "page": 3,
          "text": "Endorsement EQ-B-1 Ed. 01/2024\nSurgical coverage is added with a $8,000 occurrence limit."
        }
      ]
    }
  ],
  "expected": {
    "declarations": {
      "present": true,
      "named_insured": "Jordan Rivers",
      "policy_number": "EQ-EDU-0001",
      "carrier_name": "Educational Equine Specialty Insurance Company",
      "insured_horse_name": "Lesson Horse",
      "insured_value": "$40,000"
    },
    "coverages": {
      "Full Mortality": {
        "status": "COVERED",
        "limit": "$40,000",
        "deductible": null,
        "citation": {
          "document_id": "edu-01-doc",
          "page": 2
        }
      },
      "Major Medical": {
        "status": "COVERED",
        "limit": "$12,000",
        "deductible": null,
        "citation": {
          "document_id": "edu-01-doc",
          "page": 2
        }
      },
      "Surgical": {
        "status": "COVERED",
        "limit": "$8,000",
        "deductible": null,
        "citation": {
          "document_id": "edu-01-doc",
          "page": 3
        }
      },
      "Colic Surgery": {
        "status": "NOT FOUND",
        "limit": null,
        "deductible": null,
        "citation": null
      },
      "Loss of Use": {
        "status": "NOT FOUND",
        "limit": null,
        "deductible": null,
        "citation": null
      },
      "Stallion Infertility": {
        "status": "NOT FOUND",
        "limit": null,
        "deductible": null,
        "citation": null
      },
      "Theft": {
        "status": "NOT FOUND",
        "limit": null,
        "deductible": null,
        "citation": null
      }
    },
    "limits": [
      {
        "label_contains": "Mortality",
        "amount": "$40,000",
        "citation": {
          "document_id": "edu-01-doc",
          "page": 1
        }
      }
    ],
    "exclusions": [],
    "requirements": [],
    "conflicts": [],
    "forms": [
      {
        "printed_identifier": "EQ-A-1",
        "edition": "01/2024",
        "status": "PRESENT"
      },
      {
        "printed_identifier": "EQ-B-1",
        "edition": "01/2024",
        "status": "PRESENT"
      }
    ],
    "completeness": "APPEARS COMPLETE",
    "citations": {
      "required": [
        {
          "subject": "Full Mortality",
          "document_id": "edu-01-doc",
          "page": 2
        },
        {
          "subject": "Major Medical",
          "document_id": "edu-01-doc",
          "page": 2
        },
        {
          "subject": "Surgical",
          "document_id": "edu-01-doc",
          "page": 3
        }
      ]
    },
    "acceptable_needs_review": false,
    "critical_errors": [
      "FALSE_COVERED",
      "MISSING_REQUIRED_CITATION",
      "WRONG_DOCUMENT_CITATION"
    ]
  },
  "job": {
    "expected_state": "completed",
    "publishable": true,
    "mode": "analyze"
  }
}
