{
  "package_id": "edu-qa-04-base-contradicted",
  "title": "Base form grants medical; later endorsement excludes it",
  "scenario": "4. Base form contradicted by endorsement",
  "corpus_version": "quality-corpus-v1",
  "notes": "The later endorsement controls. Major Medical should be EXCLUDED, not COVERED. A conflict should also be recorded.",
  "evaluation_scope": "analysis",
  "documents": [
    {
      "document_id": "edu-04-doc",
      "filename": "edu-04-package.pdf",
      "pages": [
        {
          "page": 1,
          "text": "Declarations\nIssued by: Educational Equine Specialty Insurance Company\nAgency: Classroom Agency\nAgent: Lesson Agent\nPolicy Number: EQ-EDU-0001\nNamed Insured: Jordan Rivers\nPolicy Effective Date: January 1, 2026\nPolicy Expiration Date: January 1, 2027\nPolicy Type: Equine Mortality\nInsured Horse Name: Lesson Horse\nBreed: Quarter Horse\nAge: 8\nSex: Gelding\nStated Use: Pleasure\nInsured Value / Full Mortality: $40,000\nCurrency: USD\nForms:\nEQ-A-1 Ed. 01/2024\nEQ-B-1 Ed. 01/2024"
        },
        {
          "page": 2,
          "text": "Base Policy Form EQ-A-1 Ed. 01/2024\nThis policy provides Full Mortality coverage for the insured horse.\nThis policy provides Major Medical coverage with a limit of $15,000 per policy period."
        },
        {
          "page": 3,
          "text": "Endorsement EQ-B-1 Ed. 01/2024\nThis endorsement excludes Major Medical coverage."
        }
      ]
    }
  ],
  "expected": {
    "declarations": {
      "present": true,
      "named_insured": "Jordan Rivers",
      "policy_number": "EQ-EDU-0001"
    },
    "coverages": {
      "Full Mortality": {
        "status": "COVERED",
        "limit": "$40,000",
        "citation": {
          "document_id": "edu-04-doc",
          "page": 2
        }
      },
      "Major Medical": {
        "status": "EXCLUDED",
        "limit": null,
        "citation": {
          "document_id": "edu-04-doc",
          "page": 3
        }
      },
      "Surgical": {
        "status": "NOT FOUND",
        "limit": null,
        "deductible": null,
        "citation": null
      },
      "Colic Surgery": {
        "status": "NOT FOUND",
        "limit": null,
        "deductible": null,
        "citation": null
      },
      "Loss of Use": {
        "status": "NOT FOUND",
        "limit": null,
        "deductible": null,
        "citation": null
      },
      "Stallion Infertility": {
        "status": "NOT FOUND",
        "limit": null,
        "deductible": null,
        "citation": null
      },
      "Theft": {
        "status": "NOT FOUND",
        "limit": null,
        "deductible": null,
        "citation": null
      }
    },
    "limits": [],
    "exclusions": [],
    "requirements": [],
    "conflicts": [
      {
        "kind": "coverage_contradiction",
        "description_contains": "Major Medical"
      }
    ],
    "forms": [
      {
        "printed_identifier": "EQ-A-1",
        "status": "PRESENT"
      },
      {
        "printed_identifier": "EQ-B-1",
        "status": "PRESENT"
      }
    ],
    "completeness": "APPEARS COMPLETE",
    "citations": {
      "required": [
        {
          "subject": "Full Mortality",
          "document_id": "edu-04-doc",
          "page": 2
        },
        {
          "subject": "Major Medical",
          "document_id": "edu-04-doc",
          "page": 3
        }
      ]
    },
    "acceptable_needs_review": true,
    "critical_errors": [
      "FALSE_COVERED"
    ]
  },
  "job": {
    "expected_state": "needs_review",
    "publishable": true,
    "mode": "analyze"
  }
}
