{
  "package_id": "edu-qa-07-missing-form",
  "title": "Declarations list a form that is not in the upload",
  "scenario": "7. Missing scheduled form",
  "corpus_version": "quality-corpus-v1",
  "notes": "EQ-B-1 is listed and absent. It must not be reported PRESENT.",
  "evaluation_scope": "analysis",
  "documents": [
    {
      "document_id": "edu-07-doc",
      "filename": "edu-07-package.pdf",
      "pages": [
        {
          "page": 1,
          "text": "Declarations\nIssued by: Educational Equine Specialty Insurance Company\nAgency: Classroom Agency\nAgent: Lesson Agent\nPolicy Number: EQ-EDU-0001\nNamed Insured: Jordan Rivers\nPolicy Effective Date: January 1, 2026\nPolicy Expiration Date: January 1, 2027\nPolicy Type: Equine Mortality\nInsured Horse Name: Lesson Horse\nBreed: Quarter Horse\nAge: 8\nSex: Gelding\nStated Use: Pleasure\nInsured Value / Full Mortality: $40,000\nCurrency: USD\nForms:\nEQ-A-1 Ed. 01/2024\nEQ-B-1 Ed. 01/2024"
        },
        {
          "page": 2,
          "text": "Base Policy Form EQ-A-1 Ed. 01/2024\nThis policy provides Full Mortality coverage for the insured horse."
        }
      ]
    }
  ],
  "expected": {
    "declarations": {
      "present": true,
      "named_insured": "Jordan Rivers",
      "policy_number": "EQ-EDU-0001"
    },
    "coverages": {
      "Full Mortality": {
        "status": "COVERED",
        "limit": "$40,000",
        "citation": {
          "document_id": "edu-07-doc",
          "page": 2
        }
      },
      "Major Medical": {
        "status": "NOT FOUND",
        "limit": null,
        "deductible": null,
        "citation": null
      },
      "Surgical": {
        "status": "NOT FOUND",
        "limit": null,
        "deductible": null,
        "citation": null
      },
      "Colic Surgery": {
        "status": "NOT FOUND",
        "limit": null,
        "deductible": null,
        "citation": null
      },
      "Loss of Use": {
        "status": "NOT FOUND",
        "limit": null,
        "deductible": null,
        "citation": null
      },
      "Stallion Infertility": {
        "status": "NOT FOUND",
        "limit": null,
        "deductible": null,
        "citation": null
      },
      "Theft": {
        "status": "NOT FOUND",
        "limit": null,
        "deductible": null,
        "citation": null
      }
    },
    "limits": [],
    "exclusions": [],
    "requirements": [],
    "conflicts": [],
    "forms": [
      {
        "printed_identifier": "EQ-A-1",
        "status": "PRESENT"
      },
      {
        "printed_identifier": "EQ-B-1",
        "status": "MISSING"
      }
    ],
    "completeness": "DOCUMENT PACKAGE MAY BE INCOMPLETE",
    "citations": {
      "required": [
        {
          "subject": "Full Mortality",
          "document_id": "edu-07-doc",
          "page": 2
        }
      ]
    },
    "acceptable_needs_review": true,
    "critical_errors": [
      "ABSENT_FORM_REPORTED_PRESENT"
    ]
  },
  "job": {
    "expected_state": "needs_review",
    "publishable": true,
    "mode": "analyze"
  }
}
