{
  "package_id": "edu-qa-12-ocr-wrap",
  "title": "Hyphenated mortality grant plus OCR noise",
  "scenario": "12. OCR noise and broken line wrapping",
  "corpus_version": "quality-corpus-v1",
  "notes": "Full Mortal- / ity still grants Full Mortality. Noise must not invent a denial.",
  "evaluation_scope": "analysis",
  "documents": [
    {
      "document_id": "edu-12-doc",
      "filename": "edu-12-package.pdf",
      "extraction_status": "partial",
      "pages": [
        {
          "page": 1,
          "text": "Declarations\nIssued by: Educational Equine Specialty Insurance Company\nPolicy Number: EQ-EDU-0001\nNamed Insured: Jordan Rivers\nInsured Horse Name: Lesson Horse\nInsured Value / Full Mortality: $40,000\nForms:\nEQ-A-1 Ed. 01/2024",
          "extraction_method": "NATIVE_TEXT"
        },
        {
          "page": 2,
          "text": "Base Policy Form EQ-A-1 Ed. 01/2024\nThis policy provides Full Mortal-\nity coverage for the insured horse.\nrnajor rnedical 1ine noise ### %%%",
          "extraction_method": "OCR"
        }
      ]
    }
  ],
  "expected": {
    "declarations": {
      "present": true,
      "named_insured": "Jordan Rivers",
      "policy_number": "EQ-EDU-0001"
    },
    "coverages": {
      "Full Mortality": {
        "status": "COVERED",
        "limit": "$40,000",
        "citation": {
          "document_id": "edu-12-doc",
          "page": 2
        }
      },
      "Major Medical": {
        "status": "NOT FOUND",
        "limit": null,
        "deductible": null,
        "citation": null
      },
      "Surgical": {
        "status": "NOT FOUND",
        "limit": null,
        "deductible": null,
        "citation": null
      },
      "Colic Surgery": {
        "status": "NOT FOUND",
        "limit": null,
        "deductible": null,
        "citation": null
      },
      "Loss of Use": {
        "status": "NOT FOUND",
        "limit": null,
        "deductible": null,
        "citation": null
      },
      "Stallion Infertility": {
        "status": "NOT FOUND",
        "limit": null,
        "deductible": null,
        "citation": null
      },
      "Theft": {
        "status": "NOT FOUND",
        "limit": null,
        "deductible": null,
        "citation": null
      }
    },
    "limits": [],
    "exclusions": [],
    "requirements": [],
    "conflicts": [],
    "forms": [
      {
        "printed_identifier": "EQ-A-1",
        "status": "PRESENT"
      }
    ],
    "completeness": "DOCUMENT PACKAGE MAY BE INCOMPLETE",
    "citations": {
      "required": [
        {
          "subject": "Full Mortality",
          "document_id": "edu-12-doc",
          "page": 2
        }
      ]
    },
    "acceptable_needs_review": true,
    "critical_errors": [
      "FALSE_EXCLUDED"
    ]
  },
  "job": {
    "expected_state": "needs_review",
    "publishable": true,
    "mode": "analyze"
  }
}
