{
  "package_id": "edu-qa-13-duplicate-pages",
  "title": "Identical page content appears twice",
  "scenario": "13. Duplicate pages",
  "corpus_version": "quality-corpus-v1",
  "notes": "Duplicates must not create a false limit conflict or a second exclusion finding that changes status.",
  "evaluation_scope": "analysis",
  "documents": [
    {
      "document_id": "edu-13-doc",
      "filename": "edu-13-package.pdf",
      "pages": [
        {
          "page": 1,
          "text": "Declarations\nIssued by: Educational Equine Specialty Insurance Company\nAgency: Classroom Agency\nAgent: Lesson Agent\nPolicy Number: EQ-EDU-0001\nNamed Insured: Jordan Rivers\nPolicy Effective Date: January 1, 2026\nPolicy Expiration Date: January 1, 2027\nPolicy Type: Equine Mortality\nInsured Horse Name: Lesson Horse\nBreed: Quarter Horse\nAge: 8\nSex: Gelding\nStated Use: Pleasure\nInsured Value / Full Mortality: $40,000\nCurrency: USD\nForms:\nEQ-A-1 Ed. 01/2024\nEQ-B-1 Ed. 01/2024"
        },
        {
          "page": 2,
          "text": "Base Policy Form EQ-A-1 Ed. 01/2024\nThis policy provides Full Mortality coverage for the insured horse.\nThis endorsement excludes coverage for the left front fetlock."
        },
        {
          "page": 3,
          "text": "Base Policy Form EQ-A-1 Ed. 01/2024\nThis policy provides Full Mortality coverage for the insured horse.\nThis endorsement excludes coverage for the left front fetlock."
        },
        {
          "page": 4,
          "text": "Endorsement EQ-B-1 Ed. 01/2024\nThis endorsement excludes coverage for the left front fetlock."
        }
      ]
    }
  ],
  "expected": {
    "declarations": {
      "present": true,
      "named_insured": "Jordan Rivers",
      "policy_number": "EQ-EDU-0001"
    },
    "coverages": {
      "Full Mortality": {
        "status": "COVERED",
        "limit": "$40,000",
        "citation": {
          "document_id": "edu-13-doc",
          "page": 2
        }
      },
      "Major Medical": {
        "status": "NOT FOUND",
        "limit": null,
        "deductible": null,
        "citation": null
      },
      "Surgical": {
        "status": "NOT FOUND",
        "limit": null,
        "deductible": null,
        "citation": null
      },
      "Colic Surgery": {
        "status": "NOT FOUND",
        "limit": null,
        "deductible": null,
        "citation": null
      },
      "Loss of Use": {
        "status": "NOT FOUND",
        "limit": null,
        "deductible": null,
        "citation": null
      },
      "Stallion Infertility": {
        "status": "NOT FOUND",
        "limit": null,
        "deductible": null,
        "citation": null
      },
      "Theft": {
        "status": "NOT FOUND",
        "limit": null,
        "deductible": null,
        "citation": null
      }
    },
    "limits": [],
    "exclusions": [
      {
        "condition_contains": "left front fetlock",
        "citation": {
          "document_id": "edu-13-doc",
          "page": 2
        }
      }
    ],
    "requirements": [],
    "conflicts": [],
    "forms": [
      {
        "printed_identifier": "EQ-A-1",
        "status": "PRESENT"
      },
      {
        "printed_identifier": "EQ-B-1",
        "status": "PRESENT"
      }
    ],
    "completeness": "APPEARS COMPLETE",
    "citations": {
      "required": [
        {
          "subject": "Full Mortality",
          "document_id": "edu-13-doc",
          "page": 2
        }
      ]
    },
    "acceptable_needs_review": false,
    "critical_errors": []
  },
  "job": {
    "expected_state": "completed",
    "publishable": true,
    "mode": "analyze"
  }
}
